id	name	genreId	directorId	year	rating	overview	image
m076	Justice League Dark: Apokolips War	g05	p254	2020	8.3	Earth is decimated after intergalactic tyrant Darkseid has devastated the Justice League in a poorly executed war by the DC Super Heroes. Now the remaining bastions of good – the Justice League, Teen Titans, Suicide Squad and assorted others – must regroup, strategize and take the war to Darkseid in order to save the planet and its surviving inhabitants.	/c01Y4suApJ1Wic2xLmaq1QYcfoZ.jpg
m077	Back to the Future	g09	p075	1985	8.3	Eighties teenager Marty McFly is accidentally sent back in time to 1955, inadvertently disrupting his parents' first meeting and attracting his mother's romantic interest. Marty must repair the damage to history by rekindling his parents' romance and - with the help of his eccentric inventor friend Doc Brown - return to 1985.	/fNOH9f1aA7XRTzl1sAOx9iF553Q.jpg
m078	Life in a Year	g01	p261	2020	8.3	A 17 year old finds out that his girlfriend is dying, so he sets out to give her an entire life, in the last year she has left.	/bP7u19opmHXYeTCUwGjlLldmUMc.jpg
m079	Paths of Glory	g01	p265	1957	8.3	A commanding officer defends three scapegoats on trial for a failed offensive that occurred within the French Army in 1916.	/l2IY0gOHHmCWM90LjteFssxIV1G.jpg
m080	A Brighter Summer Day	g12	p269	1991	8.3	A boy experiences first love, friendships and injustices growing up in 1960s Taiwan.	/rDZ2mNQkZrnSzHPLQ7SzhzgCSoj.jpg
m081	Woman in the Dunes	g01	p273	1964	8.3	An entomologist suffers extreme psychological and sexual torture after being taken captive by the residents of a poor seaside village.	/rE6vtXBDXy3cjyFmxfsDese0Eo4.jpg
m082	We All Loved Each Other So Much	g01	p277	1974	8.3	Three partisans bound by a strong friendship return home after the war, but the clash with everyday reality puts a strain on their bond.	/zGGWYpiKNwjpKxelPxOMqJnUgDs.jpg
m083	Le Trou	g12	p281	1960	8.3	Four prison inmates have been hatching a plan to literally dig out of jail when another prisoner, Claude Gaspard, is moved into their cell. They take a risk and share their plan with the newcomer. Over the course of three days, the prisoners and friends break through the concrete floor using a bed post and begin to make their way through the sewer system -- yet their escape is anything but assured.	/8tAyoNf8M4nnMtjZ3RPwDJcx0yL.jpg
m084	Perfect Blue	g05	p285	1997	8.3	A retired pop singer turned actress' sense of reality is shaken when she is stalked by an obsessed fan and seemingly a ghost of her past.	/79vujbsWEbX4dzffBV541QXN6sf.jpg
m085	Better Days	g01	p289	2019	8.3	A bullied teenage girl forms an unlikely friendship with a mysterious young man who protects her from her assailants, while she copes with the pressures of her final examinations.	/csVZ2ZQCj98XdZoCuW1aixMYJ0W.jpg
m086	Rascal Does Not Dream of a Dreaming Girl	g05	p293	2019	8.3	In Fujisawa, Sakuta Azusagawa is in his second year of high school. Blissful days with his girlfriend and upperclassman, Mai Sakurajima, are interrupted by the appearance of his first crush, Shoko Makinohara.	/7Ai8vNEv4zEveh12JViGikoVPVV.jpg
m087	Apocalypse Now	g01	p009	1979	8.3	At the height of the Vietnam war, Captain Benjamin Willard is sent on a dangerous mission that, officially, "does not exist, nor will it ever exist." His goal is to locate - and eliminate - a mysterious Green Beret Colonel named Walter Kurtz, who has been leading his personal army on illegal guerrilla missions into enemy territory.	/fpM34wbSvkmR0wFQSmcAsZrTYvw.jpg
m088	Steven Universe: The Movie	g05	p298	2019	8.3	Two years after bringing peace to the galaxy, Steven Universe sees his past come back to haunt him in the form of a deranged Gem who wants to destroy the Earth.	/8mRgpubxHqnqvENK4Bei30xMDvy.jpg
m089	Avengers: Endgame	g09	p302	2019	8.3	After the devastating events of Avengers: Infinity War, the universe is in ruins due to the efforts of the Mad Titan, Thanos. With the help of remaining allies, the Avengers must assemble once more in order to undo Thanos' actions and restore order to the universe once and for all, no matter what consequences may be in store.	/or06FN3Dka5tukK1e9sl16pB3iy.jpg
m090	Mommy	g01	p306	2014	8.3	A peculiar neighbor offers hope to a recent widow who is struggling to raise a teenager who is unpredictable and, sometimes, violent.	/zPLyLO68iiiSF8ASGtmfXGf2EMN.jpg
m091	The Legend of 1900	g01	p083	1998	8.3	The story of a virtuoso piano player who lives his entire life aboard an ocean liner. Born and raised on the ship, 1900 (Tim Roth) learned about the outside world through interactions with passengers, never setting foot on land, even for the love of his life. Years later, the ship may be destroyed, and a former band member fears that 1900 may still be aboard, willing to go down with the ship.	/iOcbJ5pxokOPDRgieVDbsFMrCc6.jpg
m092	Tokyo Story	g01	p313	1953	8.3	The elderly Shukishi and his wife, Tomi, take the long journey from their small seaside village to visit their adult children in Tokyo. Their elder son, Koichi, a doctor, and their daughter, Shige, a hairdresser, don't have much time to spend with their aged parents, and so it falls to Noriko, the widow of their younger son who was killed in the war, to keep her in-laws company.	/g2YbTYKpY7N2yDSk7BfXZ18I5QV.jpg
m093	My Hero Academia: Heroes Rising	g05	p317	2019	8.3	Class 1-A visits Nabu Island where they finally get to do some real hero work. The place is so peaceful that it's more like a vacation … until they're attacked by a villain with an unfathomable Quirk! His power is eerily familiar, and it looks like Shigaraki had a hand in the plan. But with All Might retired and citizens' lives on the line, there's no time for questions. Deku and his friends are the next generation of heroes, and they're the island's only hope.	/zGVbrulkupqpbwgiNedkJPyQum4.jpg
m094	Miracle in Cell No. 7	g01	p321	2019	8.3	Separated from his daughter, a father with an intellectual disability must prove his innocence when he is jailed for the death of a commander's child.	/bOth4QmNyEkalwahfPCfiXjNh1r.jpg
m095	Oldboy	g01	p325	2003	8.3	With no clue how he came to be imprisoned, drugged and tortured for 15 years, a desperate businessman seeks revenge on his captors.	/pWDtjs568ZfOTMbURQBYuT4Qxka.jpg
m096	The Handmaiden	g08	p325	2016	8.3	A Japanese woman hires a handmaiden who is secretly working with a con man to cheat her out of her wealth.	/ic4s9k48semzBCUrbglyCmnGaHJ.jpg
m097	The Art of Racing in the Rain	g02	p332	2019	8.3	A family dog - with a near-human soul and a philosopher's mind - evaluates his life through the lessons learned by his human owner, a race-car driver.	/mi5VN4ww0JZgRFJIaPxxTGKjUg7.jpg
m098	Avengers: Infinity War	g09	p302	2018	8.3	As the Avengers and their allies have continued to protect the world from threats too large for any one hero to handle, a new danger has emerged from the cosmic shadows: Thanos. A despot of intergalactic infamy, his goal is to collect all six Infinity Stones, artifacts of unimaginable power, and use them to inflict his twisted will on all of reality. Everything the Avengers have fought for has led up to this moment - the fate of Earth and existence itself has never been more uncertain.	/7WsyChQLEftFiDOVTGkv3hFpyyt.jpg
m099	Klaus	g05	p337	2019	8.3	When Jesper distinguishes himself as the Postal Academy's worst student, he is sent to Smeerensburg, a small village located on an icy island above the Arctic Circle, where grumpy inhabitants barely exchange words, let alone letters. Jesper is about to give up and abandon his duty as a postman when he meets local teacher Alva and Klaus, a mysterious carpenter who lives alone in a cabin full of handmade toys.	/q125RHUDgR4gjwh1QkfYuJLYkL.jpg
m100	The Intouchables	g01	p340	2011	8.3	A true story of two men who should never have met – a quadriplegic aristocrat who was injured in a paragliding accident and a young man from the projects.	/323BP0itpxTsO0skTwdnVmf7YC9.jpg
m101	Zack Snyder's Justice League	g10	p344	2021	8.3	Determined to ensure Superman's ultimate sacrifice was not in vain, Bruce Wayne aligns forces with Diana Prince with plans to recruit a team of metahumans to protect the world from an approaching threat of catastrophic proportions.	/tnAuB8q5vv7Ax9UAEje5Xi4BXik.jpg
m102	Persona	g01	p348	1966	8.3	A young nurse, Alma, is put in charge of Elisabeth Vogler: an actress who is seemingly healthy in all respects, but will not talk. As they spend time together, Alma speaks to Elisabeth constantly, never receiving any answer. The time they spend together only strengthens the crushing realization that one does not exist.	/bdXbfUir63TQHA5NTNcXPICZCW8.jpg
m103	It's a Wonderful Life	g01	p352	1946	8.3	A holiday favourite for generations...  George Bailey has spent his entire life giving to the people of Bedford Falls.  All that prevents rich skinflint Mr. Potter from taking over the entire town is George's modest building and loan company.  But on Christmas Eve the business's $8,000 is lost and George's troubles begin.	/bSqt9rhDZx1Q7UZ86dBPKdNomp2.jpg
m104	Everything Everywhere All at Once	g10	p355	2022	8.3	An aging Chinese immigrant is swept up in an insane adventure, where she alone can save what's important to her by connecting with the lives she could have led in other universes.	/w3LxiVYdWWRvEVdn5RYq6jIqkb1.jpg
m105	The Lion King	g03	p359	1994	8.3	A young lion prince is cast out of his pride by his cruel uncle, who claims he killed his father. While the uncle rules with an iron paw, the prince grows up beyond the Savannah, living by a philosophy: No worries for the rest of your days. But when his past comes to haunt him, the young prince must decide his fate: Will he remain an outcast or face his demons and become what he needs to be?	/sKCr78MXSLixwmZ8DyJLrpMsd15.jpg
m106	Maquia: When the Promised Flower Blooms	g05	p363	2018	8.3	Maquia is a member of a special race called the Iorph who can live for hundreds of years. However, Maquia has always felt lonely despite being surrounded by her people, as she was orphaned from a young age. She daydreams about the outside world, but dares not travel from her home due to the warnings of the clan's chief.  One day the kingdom of Mezarte invades her homeland. They already have what is left of the giant dragons, the Renato, under their control, and now their king wishes to add the immortality to his bloodline.  They ravage the Iorph homeland and kill most of its inhabitants. Caught in the midst of the attack, Maquia is carried off by one of the Renato. It soon dies, and she is left deserted in a forest, now truly alone save for the cries of a single baby off in the distance. Maquia finds the baby in a destroyed village and decides to raise him as her own, naming him Ariel. Although she knows nothing of the human world, how to raise a child that ages much faster than her.	/hL3NqRE2ccR4Y2sYSJTrmalRjrz.jpg
m107	Wolf Children	g05	p366	2012	8.3	After her werewolf lover unexpectedly dies in an accident, a woman must find a way to raise the son and daughter that she had with him. However, their inheritance of their father's traits prove to be a challenge for her.	/vHMvBkr42Gh3OORcnmfCFfqJ1E.jpg
m108	Bicycle Thieves	g01	p370	1948	8.3	A working man's livelihood is threatened when someone steals his bicycle.	/ihLPR2hiHljvvdTzHk6NeNTVMXf.jpg
m109	Along with the Gods: The Last 49 Days	g01	p374	2018	8.2	In the afterlife, one guardian helps a man through his trials, while his two colleagues help a former guardian on earth.	/9BnqBHFGDv3WlCPB2qQwzAWdy7y.jpg
m110	Il Sorpasso	g01	p377	1962	8.3	Roberto, a shy law student in Rome, meets Bruno, a forty-year-old exuberant, capricious man, who takes him for a drive through the Roman and Tuscany countries in the summer. When their journey starts to blend into their daily lives though, the pair’s newfound friendship is tested.	/41BZ3auNuk5Hw6kKkxRPyOzXeqM.jpg
m111	KonoSuba: God's Blessing on this Wonderful World! Legend of Crimson	g05	p380	2019	8.2	It is not strange that the Demon Lord's forces fear the Crimson Demons, the clan from which Megumin and Yunyun originate. Even if the Demon Lord's generals attack their village, the Crimson Demons can just easily brush them off with their supreme mastery of advanced and overpowered magic.  When Yunyun receives a seemingly serious letter regarding a potential disaster coming to her hometown, she immediately informs Kazuma Satou and the rest of his party. After a series of wacky misunderstandings, it turns out to be a mere prank by her fellow demon who wants to be an author. Even so, Megumin becomes worried about her family and sets out toward the Crimson Demons' village with the gang.  There, Kazuma and the others decide to sightsee the wonders of Megumin's birthplace. However, they soon come to realize that the nonsense threat they received might have been more than just a joke.	/j73LuQcA21KvkVFcroWWMN8tTJv.jpg
m112	I Want to Eat Your Pancreas	g05	p384	2018	8.2	After his classmate and crush is diagnosed with a pancreatic disease, an average high schooler sets out to make the most of her final days.	/vHdVU0HyyB6k6kuYt8qjwTz9one.jpg
m113	Bo Burnham: Inside	g02	p387	2021	8.2	Stuck in COVID-19 lockdown, US comedian and musician Bo Burnham attempts to stay sane and happy by writing, shooting and performing a one-man comedy special.	/ku1UvTWYvhFQbSesOD6zteY7bXT.jpg
m114	Green Book	g01	p388	2018	8.2	Tony Lip, a bouncer in 1962, is hired to drive pianist Don Shirley on a tour through the Deep South in the days when African Americans, forced to find alternate accommodations and services due to segregation laws below the Mason-Dixon Line, relied on a guide called The Negro Motorist Green Book.	/7BsvSuDQuoqhWmU2fL7W2GOcZHU.jpg
m115	Miraculous World: New York, United HeroeZ	g05	p391	2020	8.2	During a school field trip, Ladybug and Cat Noir meet the American superheroes, whom they have to save from an akumatised super-villain. They discover that Miraculous exist in the United States too.	/9YbyvcrHmY2SVbdfXpb8mC4Fy0g.jpg
m116	8½	g06	p394	1963	8.2	Guido Anselmi, a film director, finds himself creatively barren at the peak of his career. Urged by his doctors to rest, Anselmi heads for a luxurious resort, but a sorry group gathers—his producer, staff, actors, wife, mistress, and relatives—each one begging him to get on with the show. In retreat from their dependency, he fantasizes about past women and dreams of his childhood.	/9wvOlM8f3obvG9tNTkpZvF0CUU1.jpg
m117	Mortal Kombat Legends: Scorpion's Revenge	g05	p397	2020	8.2	After the vicious slaughter of his family by stone-cold mercenary Sub-Zero, Hanzo Hasashi is exiled to the torturous Netherrealm. There, in exchange for his servitude to the sinister Quan Chi, he’s given a chance to avenge his family – and is resurrected as Scorpion, a lost soul bent on revenge. Back on Earthrealm, Lord Raiden gathers a team of elite warriors – Shaolin monk Liu Kang, Special Forces officer Sonya Blade and action star Johnny Cage – an unlikely band of heroes with one chance to save humanity. To do this, they must defeat Shang Tsung’s horde of Outworld gladiators and reign over the Mortal Kombat tournament.	/4VlXER3FImHeFuUjBShFamhIp9M.jpg
m118	Witness for the Prosecution	g01	p163	1957	8.2	When Leonard Vole is arrested for the sensational murder of a rich, middle-aged widow, the famous Sir Wilfrid Robarts agrees to appear on his behalf. Sir Wilfrid, recovering from a near-fatal heart attack, is supposed to be on a diet of bland, civil suits—but the lure of the criminal courts is too much for him, especially when the case is so difficult.	/mM5Cad2ESBprh6ucPnMzMfI34Cu.jpg
m119	Stalker	g15	p404	1979	8.2	Near a gray and unnamed city is the Zone, a place guarded by barbed wire and soldiers, and where the normal laws of physics are victim to frequent anomalies. A stalker guides two men into the Zone, specifically to an area in which deep-seated desires are granted.	/rem87AyEochEuhn9VvAGoMQpigz.jpg
m120	Coco	g03	p408	2017	8.2	Despite his family’s baffling generations-old ban on music, Miguel dreams of becoming an accomplished musician like his idol, Ernesto de la Cruz. Desperate to prove his talent, Miguel finds himself in the stunning and colorful Land of the Dead following a mysterious chain of events. Along the way, he meets charming trickster Hector, and together, they set off on an extraordinary journey to unlock the real story behind Miguel's family history.	/gGEsBPAijhVUFoiNpgZXqRVWJt2.jpg
m121	The Apartment	g02	p163	1960	8.2	Bud Baxter is a minor clerk in a huge New York insurance company, until he discovers a quick way to climb the corporate ladder. He lends out his apartment to the executives as a place to take their mistresses. Although he often has to deal with the aftermath of their visits, one night he's left with a major problem to solve.	/z6QlfbbORwQ2lnaCqbdEZOg3dRx.jpg
m122	Doctor Who: The Day of the Doctor	g15	p415	2013	8.2	In 2013, something terrible is awakening in London's National Gallery; in 1562, a murderous plot is afoot in Elizabethan England; and somewhere in space an ancient battle reaches its devastating conclusion. All of reality is at stake as the Doctor's own dangerous past comes back to haunt him.	/qkhP3bhxQQjs1bGEWNts64DOUkK.jpg
m123	Sansho the Bailiff	g01	p419	1954	8.2	In medieval Japan a compassionate governor is sent into exile. His wife and children try to join him, but are separated, and the children grow up amid suffering and oppression.	/rSlZ8iM4vRM0sZrrJNmjln4kZir.jpg
m124	The Kid	g02	p210	1921	8.2	A tramp cares for a boy after he's abandoned as a newborn by his mother. Later the mother has a change of heart and aches to be reunited with her son.	/drgMcyTsySQBnUPGaBThCHGdlWT.jpg
m125	A Clockwork Orange	g15	p265	1971	8.2	In a near-future Britain, young Alexander DeLarge and his pals get their kicks beating and raping anyone they please. When not destroying the lives of others, Alex swoons to the music of Beethoven. The state, eager to crack down on juvenile crime, gives an incarcerated Alex the option to undergo an invasive procedure that'll rob him of all personal agency. In a time when conscience is a commodity, can Alex change his tune?	/4sHeTAp65WrSSuc05nRBKddhBxO.jpg
m126	The Shining	g11	p265	1980	8.2	Jack Torrance accepts a caretaker job at the Overlook Hotel, where he, along with his wife Wendy and their son Danny, must live isolated from the rest of the world for the winter. But they aren't prepared for the madness that lurks within.	/b6ko0IKC8MdYBBPkkA1aBPLe2yz.jpg
m127	Children of Paradise	g01	p429	1945	8.2	Filmed during the German occupation, this French milestone centers around the theatrical life of a beautiful courtesan and the four men who love her. Voted the “Best French Film in History” by the French Film Academy in 1990.	/yiy9stl1jjVhW44ypkWMFDT8Ix3.jpg
m128	Investigation of a Citizen Above Suspicion	g01	p433	1970	8.2	Rome, Italy. After committing a heinous crime, a senior police officer exposes evidence incriminating him because his moral commitment prevents him from circumventing the law and the social order it protects.	/vPTZwlq1IC4o1DCsEZEl2uGljzm.jpg
m129	The Seventh Seal	g06	p348	1957	8.2	When disillusioned Swedish knight Antonius Block returns home from the Crusades to find his country in the grips of the Black Death, he challenges Death to a chess match for his life. Tormented by the belief that God does not exist, Block sets off on a journey, meeting up with traveling players Jof and his wife, Mia, and becoming determined to evade Death long enough to commit one redemptive act while he still lives.	/wcZ21zrOsy0b52AfAF50XpTiv75.jpg
m130	Portrait of a Lady on Fire	g01	p440	2019	8.2	On an isolated island in Brittany at the end of the eighteenth century, a female painter is obliged to paint a wedding portrait of a young woman.	/2LquGwEhbg3soxSCs9VNyh5VJd9.jpg
m131	Inglourious Basterds	g01	p063	2009	8.2	In Nazi-occupied France during World War II, a group of Jewish-American soldiers known as "The Basterds" are chosen specifically to spread fear throughout the Third Reich by scalping and brutally killing Nazis. The Basterds, lead by Lt. Aldo Raine soon cross paths with a French-Jewish teenage girl who runs a movie theater in Paris which is targeted by the soldiers.	/7sfbEnaARXDDhKm0CZ7D7uc2sbo.jpg
m132	Vertigo	g16	p096	1958	8.2	A retired San Francisco detective suffering from acrophobia investigates the strange activities of an old friend's wife, all the while becoming dangerously obsessed with her.	/15uOEfqBNTVtDUT7hGBVCka0rZz.jpg
m133	The Hate U Give	g12	p448	2018	8.2	Raised in a poverty-stricken slum, a 16-year-old girl named Starr now attends a suburban prep school. After she witnesses a police officer shoot her unarmed best friend, she's torn between her two very different worlds as she tries to speak her truth.	/2icwBom0t5nmOuZI9FVXF3gkMK0.jpg
m134	Star Wars	g09	p452	1977	8.2	Princess Leia is captured and held hostage by the evil Imperial forces in their effort to take over the galactic Empire. Venturesome Luke Skywalker and dashing captain Han Solo team together with the loveable robot duo R2-D2 and C-3PO to rescue the beautiful princess and restore peace and justice in the Empire.	/6FfCtAuVAW8XJjZ7eWeLibRLWTw.jpg
m135	Call Me by Your Name	g04	p453	2017	8.2	In 1980s Italy, a relationship begins between seventeen-year-old teenage Elio and the older adult man hired as his father's research assistant.	/mZ4gBdfkhP9tvLH1DO4m4HYtiyi.jpg
m136	The Usual Suspects	g01	p457	1995	8.2	Held in an L.A. interrogation room, Verbal Kint attempts to convince the feds that a mythic crime lord, Keyser Soze, not only exists, but was also responsible for drawing him and his four partners into a multi-million dollar heist that ended with an explosion in San Pedro harbor – leaving few survivors. Verbal lures his interrogators with an incredible story of the crime lord's almost supernatural prowess.	/bUPmtQzrRhzqYySeiMpv7GurAfm.jpg
m137	Gladiator	g10	p461	2000	8.2	In the year 180, the death of emperor Marcus Aurelius throws the Roman Empire into chaos.  Maximus is one of the Roman army's most capable and trusted generals and a key advisor to the emperor.  As Marcus' devious son Commodus ascends to the throne, Maximus is set to be executed.  He escapes, but is captured by slave traders.  Renamed Spaniard and forced to become a gladiator, Maximus must battle to the death with other men for the amusement of paying audiences.	/ty8TGRuvJLPUmAR1H1nRIsgwvim.jpg
m138	New Gods: Nezha Reborn	g05	p465	2021	8.2	While living as an ordinary deliveryman and motor racing fan, Nezha encounters old nemeses and must rediscover his powers to protect his loved ones.	/lBfBMeNJFfUvpkQsXsMwjcbNcp2.jpg
m139	Black Beauty	g01	p469	2020	8.2	Born free in the American West, Black Beauty is a horse rounded up and brought to Birtwick Stables, where she meets spirited teenager Jo Green. The two forge a bond that carries Beauty through the different chapters, challenges and adventures.	/5ZjMNJJabwBEnGVQoR2yoMEL9um.jpg
m140	Piper	g03	p473	2016	8.2	A mother bird tries to teach her little one how to find food by herself. In the process, she encounters a traumatic experience that she must overcome in order to survive.	/9tzpqQic0VJt4JCAJ5ZGrfs1qWV.jpg
m141	The Prestige	g01	p051	2006	8.2	A mysterious story of two magicians whose intense rivalry leads them on a life-long battle for supremacy -- full of obsession, deceit and jealousy with dangerous and deadly consequences.	/bdN3gXuIZYaJP7ftKK2sU0nPtEA.jpg
m142	Saving Private Ryan	g01	p013	1998	8.2	As U.S. troops storm the beaches of Normandy, three brothers lie dead on the battlefield, with a fourth trapped behind enemy lines. Ranger captain John Miller and seven men are tasked with penetrating German-held territory and bringing the boy home.	/1wY4psJ5NVEhCuOYROwLH2XExM2.jpg
m143	Violet Evergarden: Eternity and the Auto Memory Doll	g01	p477	2019	8.2	Isabella, the daughter of the noble York family, is enrolled in an all-girls academy to be groomed into a dame worthy of nobility. However, she has given up on her future, seeing the prestigious school as nothing more than a prison from the outside world. Her family notices her struggling in her lessons and decides to hire Violet Evergarden to personally tutor her under the guise of a handmaiden.  At first, Isabella treats Violet coldly. Violet seems to be able to do everything perfectly, leading Isabella to assume that she was born with a silver spoon. After some time, Isabella begins to realize that Violet has had her own struggles and starts to open up to her. Isabella soon reveals that she has lost contact with her beloved younger sister, whom she yearns to see again.  Having experienced the power of words through her past clientele, Violet asks if Isabella wishes to write a letter to Taylor. Will Violet be able to help Isabella convey her feelings to her long-lost sister?	/zjaSw6Ok0MhXjrruPrA27VHyUYC.jpg
m144	Memento	g16	p051	2000	8.2	Leonard Shelby is tracking down the man who raped and murdered his wife. The difficulty of locating his wife's killer, however, is compounded by the fact that he suffers from a rare, untreatable form of short-term memory loss. Although he can recall details of life before his accident, Leonard cannot remember what happened fifteen minutes ago, where he's going, or why.	/yuNs09hvpHVU1cBTCAk9zxsL2oW.jpg
