id	name	genreId	directorId	year	rating	overview	image
m145	The Help	g01	p482	2011	8.2	Aibileen Clark is a middle-aged African-American maid who has spent her life raising white children and has recently lost her only son; Minny Jackson is an African-American maid who has often offended her employers despite her family's struggles with money and her desperate need for jobs; and Eugenia "Skeeter" Phelan is a young white woman who has recently moved back home after graduating college to find out her childhood maid has mysteriously disappeared. These three stories intertwine to explain how life in Jackson, Mississippi revolves around "the help"; yet they are always kept at a certain distance because of racial lines.	/7XLSwxpfpPoJyTdJVot6a42TS2V.jpg
m146	My Mom is a Character 3	g02	p486	2019	8.2	Dona Hermínia will have to rediscover and reinvent herself because her children are forming new families. This supermom will have to deal with a new life scenario: Marcelina is pregnant and Juliano is getting married.	/zw77BFPGJ73Lig8GwRzYj1XHq53.jpg
m147	The Matrix	g10	p490	1999	8.2	Set in the 22nd century, The Matrix tells the story of a computer hacker who joins a group of underground insurgents fighting the vast and powerful computers who now rule the earth.	/f89U3ADr1oiB1s9GkdPOEpXUk5H.jpg
m148	Shutter Island	g01	p079	2010	8.2	World War II soldier-turned-U.S. Marshal Teddy Daniels investigates the disappearance of a patient from a hospital for the criminally insane, but his efforts are compromised by troubling visions and a mysterious doctor.	/kve20tXwUZpu4GUX8l6X7Z4jmL6.jpg
m149	Hacksaw Ridge	g01	p493	2016	8.2	WWII American Army Medic Desmond T. Doss, who served during the Battle of Okinawa, refuses to kill people and becomes the first Conscientious Objector in American history to receive the Congressional Medal of Honor.	/fTuxNlgEm04PPFkr1xfK94Jn8BW.jpg
m150	Capernaum	g01	p497	2018	8.2	Zain, a 12-year-old boy scrambling to survive on the streets of Beirut, sues his parents for having brought him into such an unjust world, where being a refugee with no documents means that your rights can easily be denied.	/cqkqrIDzvkFRWVbRRQLqtkXQoPu.jpg
m151	Soul	g05	p501	2020	8.2	Joe Gardner is a middle school teacher with a love for jazz music. After a successful audition at the Half Note Club, he suddenly gets into an accident that separates his soul from his body and is transported to the You Seminar, a center in which souls develop and gain passions before being transported to a newborn child. Joe must enlist help from the other souls-in-training, like 22, a soul who has spent eons in the You Seminar, in order to get back to Earth.	/hm58Jw4Lw8OIeECIq5qyPYhAeRJ.jpg
m152	Taxi Driver	g12	p079	1976	8.2	A mentally unstable Vietnam War veteran works as a night-time taxi driver in New York City where the perceived decadence and sleaze feed his urge for violent action.	/ekstpH614fwDX8DUln1a2Opz0N8.jpg
m153	Wonder	g01	p506	2017	8.2	The story of August Pullman – a boy with facial differences – who enters fifth grade, attending a mainstream elementary school for the first time.	/ouYgAatYH4JzIThj6FI3UYf31RI.jpg
m154	Singin' in the Rain	g02	p510	1952	8.2	In 1927 Hollywood, a silent film production company and cast make a difficult transition to sound.	/zjrpWniKbzu0zFR5sUI1Ptdfl9y.jpg
m155	Bo Burnham: Make Happy	g02	p387	2016	8.2	Combining his trademark wit and self-deprecating humor with original music, Bo Burnham offers up his unique twist on life in this stand-up special about  life, death, sexuality, hypocrisy, mental illness and Pringles cans.	/1RqDE7X2rGjxKOklweUFd2U7Vn0.jpg
m156	Metropolis	g01	p515	1927	8.2	In a futuristic city sharply divided between the rich and the poor, the son of the city's mastermind meets a prophet who predicts the coming of a savior to mediate their differences.	/hUK9rewffKGqtXynH5SW3v9hzcu.jpg
m157	Luck	g05	p519	2022	8.2	Suddenly finding herself in the never-before-seen Land of Luck, the unluckiest person in the world must unite with the magical creatures there to turn her luck around.	/1HOYvwGFioUFL58UVvDRG6beEDm.jpg
m158	Joker	g12	p523	2019	8.2	During the 1980s, a failed stand-up comedian is driven insane and turns to a life of crime and chaos in Gotham City while becoming an infamous psychopathic crime figure.	/udDclJoHjfjb8Ekgsd4FDteOkCU.jpg
m159	Scenes from a Marriage	g01	p348	1974	8.2	Johan and Marianne are married and seem to have it all. Their happiness, however, is a façade for a troubled relationship, which becomes even rockier when Johan admits that he's having an affair. Before long, the spouses separate and move towards finalizing their divorce, but they make attempts at reconciling. Even as they pursue other relationships, Johan and Marianne realize that they have a significant bond, but also many issues that hinder that connection.	/ArKEdvJesIktFX8OAhcdKAOLl6I.jpg
m160	Yojimbo	g01	p087	1961	8.2	A nameless ronin, or samurai with no master, enters a small village in feudal Japan where two rival businessmen are struggling for control of the local gambling trade. Taking the name Sanjuro Kuwabatake, the ronin convinces both silk merchant Tazaemon and sake merchant Tokuemon to hire him as a personal bodyguard, then artfully sets in motion a full-scale gang war between the two ambitious and unscrupulous men.	/tN7kYPjRhDolpui9sc9Eq9n5b2O.jpg
m161	Far from the Tree	g05	p527	2021	8.2	On an idyllic beach in the Pacific Northwest, curiosity gets the better of a young raccoon whose frustrated parent attempts to keep them both safe.	/39oaQUS0KxyXL6KYJ2o2u03PpHz.jpg
m162	Casablanca	g01	p528	1942	8.2	In Casablanca, Morocco in December 1941, a cynical American expatriate meets a former lover, with unforeseen complications.	/5K7cOHoay2mZusSLezBOY0Qxh8a.jpg
m163	All About Eve	g01	p532	1950	8.2	From the moment she glimpses her idol at the stage door, Eve Harrington is determined to take the reins of power away from the great actress Margo Channing. Eve maneuvers her way into Margo's Broadway role, becomes a sensation and even causes turmoil in the lives of Margo's director boyfriend, her playwright and his wife. Only the cynical drama critic sees through Eve, admiring her audacity and perfect pattern of deceit.	/6numIZH6uR3NlJgY9m7nGH0jhs.jpg
m164	Scarface	g10	p536	1983	8.2	After getting a green card in exchange for assassinating a Cuban government official, Tony Montana stakes a claim on the drug trade in Miami. Viciously murdering anyone who stands in his way, Tony eventually becomes the biggest drug lord in the state, controlling nearly all the cocaine that comes through Miami. But increased pressure from the police, wars with Colombian drug cartels and his own drug-fueled paranoia serve to fuel the flames of his eventual downfall.	/iQ5ztdjvteGeboxtmRdXEChJOHh.jpg
m165	Togo	g09	p539	2019	8.2	The untold true story set in the winter of 1925 that takes you across the treacherous terrain of the Alaskan tundra for an exhilarating and uplifting adventure that will test the strength, courage and determination of one man, Leonhard Seppala, and his lead sled dog, Togo.	/hFoDiWyNTpnMFLTFFEDhuBG59Bq.jpg
m166	The Father	g01	p543	2020	8.2	A man refuses all assistance from his daughter as he ages and, as he tries to make sense of his changing circumstances, he begins to doubt his loved ones, his own mind and even the fabric of his reality.	/pr3bEQ517uMb5loLvjFQi8uLAsp.jpg
m167	Ayla: The Daughter of War	g01	p546	2017	8.2	In 1950, amidst the ravages of the Korean War, Sergeant Süleyman stumbles upon a a half-frozen little girl, with no parents and no help in sight. Frantic, scared and on the verge of death, this little girl captures the heart of Süleyman, who risks his own life to save her, smuggling her into his Army base and out of harms way. Not knowing her name and unable to communicate with her, Süleyman names her Ayla, in reminiscence of the moon on the fateful night during which they met. The two form an instantaneous and inseparable bond, and Ayla, almost effortlessly, brings an uncanny joy to the Turkish brigade in the grip of war. As the war comes to a close however, Süleyman's brigade is told that they will be returning home. Süleyman cannot bear abandoning Ayla, and does everything within his power to take her with him. After repeated failure, he is forced to give Ayla to an orphanage, but doesn't give up on the hope of one day reuniting with her. Will the two ever get back together?	/pYhlkqBLMZuH8UmzTkENeSQ2vhb.jpg
m168	My Friends	g02	p550	1975	8.2	Four middle-aged friends in Florence organize together idle pranks (called zingarate, "gypsy shenanigans") in a continuous attempt to prolong childhood during their adult life.	/8Pm8SLjq2UHCwisd56ipHtzvZI1.jpg
m169	La Dolce Vita	g02	p394	1960	8.2	Journalist and man-about-town Marcello struggles to find his place in the world, torn between the allure of Rome's elite social scene and the stifling domesticity offered by his girlfriend, all the while searching for a way to become a serious writer.	/5Zq9pAs3Y9TrFHxO0nEbq3QVTtj.jpg
m170	The Departed	g01	p079	2006	8.2	To take down South Boston's Irish Mafia, the police send in one of their own to infiltrate the underworld, not realizing the syndicate has done likewise. While an undercover cop curries favor with the mob kingpin, a career criminal rises through the police ranks. But both sides soon discover there's a mole among them.	/kWWAt2FMRbqLFFy8o5R4Zr8cMAb.jpg
m171	Lock, Stock and Two Smoking Barrels	g02	p555	1998	8.2	A card shark and his unwillingly-enlisted friends need to make a lot of cash quick after losing a sketchy poker match. To do this they decide to pull a heist on a small-time gang who happen to be operating out of the flat next door.	/8kSerJrhrJWKLk1LViesGcnrUPE.jpg
m172	Sherlock Jr.	g10	p559	1924	8.2	A film projectionist longs to be a detective, and puts his meagre skills to work when he is framed by a rival for stealing his girlfriend's father's pocketwatch.	/1G9r3rqtbFAQuyWKOZm4Y5J5s7Q.jpg
m173	Central Station	g01	p562	1998	8.2	An emotive journey of a former school teacher, who writes letters for illiterate people, and a young boy, whose mother has just died, as they search for the father he never knew.	/zJvp7XjQ2LhPbDVYhFXyucs40vR.jpg
m174	Rashomon	g12	p087	1950	8.2	Brimming with action while incisively examining the nature of truth, "Rashomon" is perhaps the finest film ever to investigate the philosophy of justice. Through an ingenious use of camera and flashbacks, Kurosawa reveals the complexities of human nature as four people recount different versions of the story of a man's murder and the rape of his wife.	/vL7Xw04nFMHwnvXRFCmYYAzMUvY.jpg
m175	Django Unchained	g01	p063	2012	8.2	With the help of a German bounty hunter, a freed slave sets out to rescue his wife from a brutal Mississippi plantation owner.	/7oWY8VDWW7thTzWh3OKYRkWUlD5.jpg
m176	Andrei Rublev	g01	p404	1966	8.2	An expansive Russian drama, this film focuses on the life of revered religious icon painter Andrei Rublev. Drifting from place to place in a tumultuous era, the peace-seeking monk eventually gains a reputation for his art. But after Rublev witnesses a brutal battle and unintentionally becomes involved, he takes a vow of silence and spends time away from his work. As he begins to ease his troubled soul, he takes steps towards becoming a painter once again.	/910xRIUmNJrWH2hkQifBJtoPp5R.jpg
m177	Double Indemnity	g12	p163	1944	8.1	A rich woman and a calculating insurance agent plot to kill her unsuspecting husband after he signs a double indemnity policy. Against a backdrop of distinctly Californian settings, the partners in crime plan the perfect murder to collect the insurance, which pays double if the death is accidental.	/7YNuG4Az4RotLmY3SvFdAFhSW5l.jpg
m178	Reservoir Dogs	g12	p063	1992	8.1	A botched robbery indicates a police informant, and the pressure mounts in the aftermath at a warehouse. Crime begets violence as the survivors -- veteran Mr. White, newcomer Mr. Orange, psychopathic parolee Mr. Blonde, bickering weasel Mr. Pink and Nice Guy Eddie -- unravel.	/lsBnfheKZBO3UKU7lVHIeGZLWuF.jpg
m179	The Great War	g01	p550	1959	8.1	Italy, 1916. Oreste Jacovacci and Giovanni Busacca are called, as all the Italian youths, to serve the army in the WWI. They both try in every way to avoid serving the army.	/aDvKsUb5y7GMNMz2HHNtuGww5t8.jpg
m180	Full Metal Jacket	g01	p265	1987	8.1	A pragmatic U.S. Marine observes the dehumanizing effects the U.S.-Vietnam War has on his fellow recruits from their brutal boot camp training to the bloody street fighting in Hue.	/kMKyx1k8hWWscYFnPbnxxN4Eqo4.jpg
m181	Good Will Hunting	g01	p577	1997	8.1	Will Hunting has a genius-level IQ but chooses to work as a janitor at MIT. When he solves a difficult graduate-level math problem, his talents are discovered by Professor Gerald Lambeau, who decides to help the misguided youth reach his potential. When Will is arrested for attacking a police officer, Professor Lambeau makes a deal to get leniency for him if he will get treatment from therapist Sean Maguire.	/bABCBKYBK7A5G1x0FzoeoNfuj2.jpg
m182	Me Against You: Mr. S's Vendetta	g02	p578	2020	8.1	A young couple who makes popular YouTube videos for children sets out to win an award, but an evil mastermind stands in the way of their success.	/4XzbcAKdX4n3aWfzBjjeAlm68S3.jpg
m183	Nobody	g10	p582	2021	8.1	Hutch Mansell, a suburban dad, overlooked husband, nothing neighbor — a "nobody." When two thieves break into his home one night, Hutch's unknown long-simmering rage is ignited and propels him on a brutal path that will uncover dark secrets he fought to leave behind.	/oBgWY00bEFeZ9N25wWVyuQddbAo.jpg
m184	Cruella	g02	p584	2021	8.1	In 1970s London amidst the punk rock revolution, a young grifter named Estella is determined to make a name for herself with her designs. She befriends a pair of young thieves who appreciate her appetite for mischief, and together they are able to build a life for themselves on the London streets. One day, Estella’s flair for fashion catches the eye of the Baroness von Hellman, a fashion legend who is devastatingly chic and terrifyingly haute. But their relationship sets in motion a course of events and revelations that will cause Estella to embrace her wicked side and become the raucous, fashionable and revenge-bent Cruella.	/wToO8opxkGwKgSfJ1JK8tGvkG6U.jpg
m185	Dr. Strangelove or: How I Learned to Stop Worrying and Love the Bomb	g01	p265	1964	8.1	After the insane General Jack D. Ripper initiates a nuclear strike on the Soviet Union, a war room full of politicians, generals and a Russian diplomat all frantically try to stop the nuclear strike.	/gHm96BRW4GoI339rF1vYoYTB6Qe.jpg
m186	Wild Strawberries	g01	p348	1957	8.1	Crotchety retired doctor Isak Borg travels from Stockholm to Lund, Sweden, with his pregnant and unhappy daughter-in-law, Marianne, in order to receive an honorary degree from his alma mater. Along the way, they encounter a series of hitchhikers, each of whom causes the elderly doctor to muse upon the pleasures and failures of his own life. These include the vivacious young Sara, a dead ringer for the doctor's own first love.	/iyTD2QnySNMPUPE3IedZQipSWfz.jpg
m187	Out of the Clear Blue Sky	g02	p592	2019	8.1	Returning to Earth as an imitator, the legendary Mexican artist Pedro Infante must prove that he is no longer a womanizer to enter paradise.	/xg6QZdlHrq2dtSK8cfnQQMnmpeY.jpg
m188	Some Like It Hot	g02	p163	1959	8.1	Two musicians witness a mob hit and struggle to find a way out of the city before they are found by the gangsters. Their only opportunity is to join an all-girl band as they leave on a tour. To make their getaway they must first disguise themselves as women, then keep their identities secret and deal with the problems this brings - such as an attractive bandmate and a very determined suitor.	/hVIKyTK13AvOGv7ICmJjK44DTzp.jpg
m189	Alien	g11	p461	1979	8.1	During its return to the earth, commercial spaceship Nostromo intercepts a distress signal from a distant planet. When a three-member team of the crew discovers a chamber containing thousands of eggs on the planet, a creature inside one of the eggs attacks an explorer. The entire crew is unaware of the impending nightmare set to descend upon them when the alien parasite planted inside its unfortunate host is birthed.	/vfrQk5IPloGg1v9Rzbh2Eg3VGyM.jpg
m190	The Invisible Guest	g01	p601	2017	8.1	Barcelona, Spain. Adrián Doria, a young and successful businessman accused of murder, meets one night with Virginia Goodman, an expert interrogation lawyer, in order to devise a defense strategy.	/fptnZJbLzKUHeNlYrAynbyoL5YJ.jpg
m191	Anne of Green Gables	g03	p605	1985	8.1	At the turn of the century on Prince Edward Island, Matthew Cuthbert and his sister Marilla decide to take on an orphan boy as help for their farm. But they get an unexpected jolt when they're mistakenly sent a girl instead: Anne Shirley.	/wuF8aapqbDPFkoWbwI5LWfDXpVq.jpg
m192	Paper Lives	g01	p546	2021	8.1	In the streets of Istanbul, ailing waste warehouse worker Mehmet takes a small boy under his wing and must soon confront his own traumatic childhood.	/cmru6N6Hnw2pJwuo1ctH1CxKqKZ.jpg
m193	How to Train Your Dragon: Homecoming	g05	p612	2019	8.1	It's been ten years since the dragons moved to the Hidden World, and even though Toothless doesn't live in New Berk anymore, Hiccup continues the holiday traditions he once shared with his best friend. But the Vikings of New Berk were beginning to forget about their friendship with dragons. Hiccup, Astrid, and Gobber know just what to do to keep the dragons in the villagers' hearts. And across the sea, the dragons have a plan of their own...	/kXj2Qrfm994yLeuADqbOieU1mUH.jpg
m194	The Tale of The Princess Kaguya	g05	p104	2013	8.1	Found inside a shining stalk of bamboo by an old bamboo cutter and his wife, a tiny girl grows rapidly into an exquisite young lady. The mysterious young princess enthrals all who encounter her. But, ultimately, she must confront her fate, the punishment for her crime.	/mWRQNlWXYYfd2z4FRm99MsgHgiA.jpg
m195	Paris, Texas	g01	p619	1984	8.1	A man wanders out of the desert not knowing who he is. His brother finds him, and helps to pull his memory back of the life he led before he walked out on his family and disappeared four years earlier.	/6NuFYT1f1rG0AeIVTJEgsRa7AOi.jpg
m196	Big Deal on Madonna Street	g02	p550	1958	8.1	Best friends Peppe and Mario are thieves, but they're not very good at it. Still, Peppe thinks that he's finally devised a master heist that will make them rich. With the help of some fellow criminals, he plans to dig a tunnel from a rented apartment to the pawnshop next door, where they can rob the safe. But his plan is far from foolproof, and the fact that no one in the group has any experience digging tunnels proves to be the least of their problems.	/f5OxD8Nl0pR3DcYHtYhHRfpsmjl.jpg
m197	Dersu Uzala	g10	p087	1975	8.1	A military explorer meets and befriends a Goldi man in Russia’s unmapped forests. A deep and abiding bond evolves between the two men, one civilized in the usual sense, the other at home in the glacial Siberian woods.	/i6Z4A77eO22hD0rOUu7NlCMdZBr.jpg
m198	Harry Potter and the Deathly Hallows: Part 2	g06	p628	2011	8.1	Harry, Ron and Hermione continue their quest to vanquish the evil Voldemort once and for all. Just as things begin to look hopeless for the young wizards, Harry discovers a trio of magical objects that endow him with powers to rival Voldemort's formidable skills.	/c54HpQmuwXjHq2C9wmoACjxoom3.jpg
m199	Red Beard	g01	p087	1965	8.1	Aspiring to an easy job as personal physician to a wealthy family, Noboru Yasumoto is disappointed when his first post after medical school takes him to a small country clinic under the gruff doctor Red Beard. Yasumoto rebels in numerous ways, but Red Beard proves a wise and patient teacher. He gradually introduces his student to the unglamorous side of the profession, ultimately assigning him to care for a prostitute rescued from a local brothel.	/fo800fRcWtl3Zhs6tPHfXP4KBak.jpg
m200	Michael Jackson's Thriller	g11	p634	1983	8.1	A night at the movies turns into a nightmare when Michael and his date are attacked by a horde of bloody-thirsty zombies.	/djv4LM6uanJriwpsOyJzaaSp4gf.jpg
m201	The Truman Show	g02	p230	1998	8.1	Truman Burbank is the star of The Truman Show, a 24-hour-a-day reality TV show that broadcasts every aspect of his life without his knowledge. His entire life has been an unending soap opera for consumption by the rest of the world. And everyone he knows, including his wife and his best friend is really an actor, paid to be part of his life.	/vuza0WqY239yBXOadKlGwJsZJFE.jpg
m202	M	g01	p515	1931	8.1	In this classic German thriller, Hans Beckert, a serial killer who preys on children, becomes the focus of a massive Berlin police manhunt. Beckert's heinous crimes are so repellant and disruptive to city life that he is even targeted by others in the seedy underworld network. With both cops and criminals in pursuit, the murderer soon realizes that people are on his trail, sending him into a tense, panicked attempt to escape justice.	/slsS6jT6SXjcTPOrsFcLIrHboXA.jpg
m203	Pather Panchali	g01	p644	1955	8.1	Impoverished priest Harihar Ray, dreaming of a better life for himself and his family, leaves his rural Bengal village in search of work.	/frZj5djlU9hFEjMcL21RJZVuG5O.jpg
m204	Along with the Gods: The Two Worlds	g01	p374	2017	8.1	Having died unexpectedly, firefighter Ja-hong is taken to the afterlife by 3 afterlife guardians. Only when he passes 7 trials over 49 days and proves he was innocent in human life, he’s able to reincarnate, and his 3 afterlife guardians are by his side to defend him in trial.	/gJSvIsI6oQfFim0PGyuuiCYfqKs.jpg
m205	I corti	g02	p649	1996	8.1	I corti ("shorts") by Aldo, Giovanni & Giacomo was the first stage show of the comedy trio, with the participation of Marina Massironi. It was recorded live at the Teatro Nuovo in Ferrara on 28 and 29 March 1996. Produced by Agidi, with the theatre direction of Arturo Brachetti.	/9uZhgmOAH7eW4uWGL49HgIA0JtE.jpg
m206	A Special Day	g01	p277	1977	8.1	In Rome, fascist supporter Emanuele attends a parade commemorating Adolf Hitler's historic meeting with Italian leader Benito Mussolini, leaving his apolitical wife, Antonietta, to tend to household duties. Antonietta encounters a man, Gabriele, who appears surprisingly nonplussed by the political event. Over the course of the day, the two forge a close friendship that will forever change their perceptions of life, love and politics.	/6ZzkiTbuf2ltEPunhQolGIcckyS.jpg
m207	Incendies	g01	p655	2010	8.1	A mother's last wishes send twins Jeanne and Simon on a journey to Middle East in search of their tangled roots. Adapted from Wajdi Mouawad's acclaimed play, Incendies tells the powerful and moving tale of two young adults' voyage to the core of deep-rooted hatred, never-ending wars and enduring love.	/zQdcNGCi4aVIv02wMHaTWlF7M2w.jpg
m208	In the Mood for Love	g01	p659	2000	8.1	Hong Kong, 1962: Chow Mo-Wan and Su Li-Zhen move into neighboring apartments on the same day. Their encounters are formal and polite—until a discovery about their spouses creates an intimate bond between them.	/iYypPT4bhqXfq1b6EnmxvRt6b2Y.jpg
m209	Toto, Peppino, and the Hussy	g02	p663	1956	8.1	Antonio, Peppino and Lucia are three brothers who live in the country near Naples. Lucia's son, Gianni, goes to Naples to study medicine, but there he knows a ballet dancer. They fall in love and, when she goes to Milan, Gianni follows her. Informed of this and afraid that their nephew will stop studying, the three Caponi brothers leave for Milan to persuade Gianni to come back and continue studying and abandon the "Malafemmina" (bad girl).	/rHsc35TLPliJAvbnmu8dvddiu96.jpg
m210	There Will Be Blood	g01	p667	2007	8.1	Ruthless silver miner, turned oil prospector, Daniel Plainview, moves to oil-rich California. Using his son to project a trustworthy, family-man image, Plainview cons local landowners into selling him their valuable properties for a pittance. However, local preacher Eli Sunday suspects Plainview's motives and intentions, starting a slow-burning feud that threatens both their lives.	/fa0RDkAlCec0STeMNAhPaF89q6U.jpg
m211	Hannah Gadsby: Nanette	g02	p671	2018	8.1	The Australian comedian Hannah Gadsby is taking an anti-comedy stance in her newest special.	/xyDapdXEqic7pkLFvvvEW5dI3or.jpg
m212	Eternal Sunshine of the Spotless Mind	g15	p673	2004	8.1	Joel Barish, heartbroken that his girlfriend underwent a procedure to erase him from her memory, decides to do the same. However, as he watches his memories of her fade away, he realises that he still loves her, and may be too late to correct his mistake.	/5MwkWH9tYHv3mV9OdYTMR5qreIz.jpg
m213	Straight Outta Nowhere: Scooby-Doo! Meets Courage the Cowardly Dog	g05	p675	2021	8.1	With Mystery, Inc. on the tail of a strange object in Nowhere, Kansas, the strange hometown of Eustice, Muriel, and Courage, the gang soon find themselves contending with a giant cicada monster and her winged warriors.	/uIdMpWrQ30SHPINsy7LcPFloyvO.jpg
m214	Three Billboards Outside Ebbing, Missouri	g12	p679	2017	8.1	After seven months have passed without a culprit in her daughter's murder case, Mildred Hayes makes a bold move, painting three signs leading into her town with a controversial message directed at Bill Willoughby, the town's revered chief of police. When his second-in-command Officer Jason Dixon, an immature mother's boy with a penchant for violence, gets involved, the battle between Mildred and Ebbing's law enforcement is only exacerbated.	/uGMM9ZObmPUFrGqcbFMVyv8L1lU.jpg
m215	The Hunt	g01	p683	2012	8.1	A teacher lives a lonely life, all the while struggling over his son’s custody. His life slowly gets better as he finds love and receives good news from his son, but his new luck is about to be brutally shattered by an innocent little lie.	/jkixsXzRh28q3PCqFoWcf7unghT.jpg
