id	name	genreId	directorId	year	rating	overview	image
m216	In the Arms of an Assassin	g04	p687	2019	8.1	Victor (William Levy) is one of the world’s most handsome  men, but he has a deep secret – he is a cold blooded assassin. Smooth talking and seductive, Victor was raised to do one thing only, which is to kill for money. When he is sent to the home of a brutal drug lord to collect payment for his most recent hit, he encounters the beautiful Sarai (Alicia Sanz), who has been forced to spend the last 9 years of her life with the drug lord.	/iqRUOtbDunNq7gTux3zXz25Krwp.jpg
m217	The Passion of Joan of Arc	g01	p691	1928	8.1	A classic of the silent age, this film tells the story of the doomed but ultimately canonized 15th-century teenage warrior. On trial for claiming she'd spoken to God, Jeanne d'Arc is subjected to inhumane treatment and scare tactics at the hands of church court officials. Initially bullied into changing her story, Jeanne eventually opts for what she sees as the truth. Her punishment, a famously brutal execution, earns her perpetual martyrdom.	/8OYGtQlO8k9PcOm49apV62eVJQo.jpg
m218	Lion	g01	p695	2016	8.1	A five-year-old Indian boy gets lost on the streets of Calcutta, thousands of kilometers from home. He survives many challenges before being adopted by a couple in Australia; 25 years later, he sets out to find his lost family.	/kCELJH1tCmaRLqvwIgKDb09aEaw.jpg
m219	The 400 Blows	g01	p699	1959	8.1	For young Parisian boy Antoine Doinel, life is one difficult situation after another. Surrounded by inconsiderate adults, including his neglectful parents, Antoine spends his days with his best friend, Rene, trying to plan for a better life. When one of their schemes goes awry, Antoine ends up in trouble with the law, leading to even more conflicts with unsympathetic authority figures.	/12PuU23kkDLvTd0nb8hMlE3oShB.jpg
m220	Scooby-Doo! and Kiss: Rock and Roll Mystery	g03	p703	2015	8.1	Get ready to Rock! Scooby-Doo and the Mystery Inc. Gang team up with the one and only KISS in this all-new, out-of-this-world adventure! We join the Gang at Kiss World – the all-things-Kiss theme park, as they investigate a series of strange hauntings. With help from Kiss, they discover that the Crimson Witch has returned to summon The Destroyer from the alternate dimension of Kissteria! The evil duos ghastly plan, to destroy the earth! Can the Gang's cunning and Kiss's power of rock save the day?!	/dubNbVmMmE9vULPA5CZokqUJ0o6.jpg
m221	The Best of Youth	g01	p706	2003	8.1	Spanning nearly four decades, this generational epic follows two Italian brothers from a middle-class family through some of the most significant events of postwar Italian history after their life paths diverge thanks to one fateful encounter during the summer of 1966.	/ltmcFRvTeAgBgMLUGa15KzDSQqs.jpg
m222	Pride & Prejudice	g01	p710	2005	8.1	A story of love and life among the landed English gentry during the Georgian era. Mr. Bennet is a gentleman living in Hertfordshire with his overbearing wife and five daughters, but if he dies their house will be inherited by a distant cousin whom they have never met, so the family's future happiness and security is dependent on the daughters making good marriages.	/sGjIvtVvTlWnia2zfJfHz81pZ9Q.jpg
m223	Prey	g10	p714	2022	8.1	When danger threatens her camp, the fierce and highly skilled Comanche warrior Naru sets out to protect her people. But the prey she stalks turns out to be a highly evolved alien predator with a technically advanced arsenal.	/ujr5pztc1oitbe7ViMUOilFaJ7s.jpg
m224	Thirteen Lives	g01	p718	2022	8.1	Based on the true nail-biting mission that captivated the world. Twelve boys and the coach of a Thai soccer team explore the Tham Luang cave when an unexpected rainstorm traps them in a chamber inside the mountain. Entombed behind a maze of flooded cave tunnels, they face impossible odds. A team of world-class divers navigate through miles of dangerous cave networks to discover that finding the boys is only the beginning.	/yi5KcJqFxy0D6yP8nCfcF8gJGg5.jpg
m225	Believe Me: The Abduction of Lisa McVey	g01	p721	2018	8.1	On the night she plans on taking her own life, 17-year-old 'Lisa McVey' is kidnapped and finds herself fighting to stay alive and manages to be a victim of rape. She manages to talk her attacker into releasing her, but when she returns home, no one believes her story except for one detective, who suspects she was abducted by a serial killer. Based on horrifying true events.	/1X53fMPuNL5FxrSXTLssjYYKhxS.jpg
m226	Love, Simon	g02	p725	2018	8.1	Everyone deserves a great love story. But for seventeen-year old Simon Spier it's a little more complicated: he's yet to tell his family or friends he's gay and he doesn't know the identity of the anonymous classmate he's fallen for online.	/5YUYg5q7QfC4IoNwNUtiwdiYKPr.jpg
m227	The Elephant Man	g01	p729	1980	8.1	A Victorian surgeon rescues a heavily disfigured man being mistreated by his "owner" as a side-show freak. Behind his monstrous façade, there is revealed a person of great intelligence and sensitivity. Based on the true story of Joseph Merrick (called John Merrick in the film), a severely deformed man in 19th century London.	/rk2lKgEtjF9HO9N2UFMRc2cMGdj.jpg
m228	La Haine	g01	p731	1995	8.1	After a chaotic night of rioting in a marginal suburb of Paris, three young friends, Vinz, Hubert and Saïd, wander around unoccupied waiting for news about the state of health of a mutual friend who has been seriously injured when confronting the police.	/7izWzrLEMUlOr971nhqXXktjz5Y.jpg
m229	Das Boot	g01	p735	1981	8.1	A German submarine hunts allied ships during the Second World War, but it soon becomes the hunted. The crew tries to survive below the surface, while stretching both the boat and themselves to their limits.	/fvobAlXFCsCXqZlPYMGhu5W9gvr.jpg
m230	Mirror	g01	p404	1975	8.1	A dying man in his forties recalls his childhood, his mother, the war and personal moments that tell of and juxtapose pivotal moments in Soviet history with daily life.	/AttDP5OEsMxtHPPN7Z92p2Ntnmd.jpg
m231	Terminator 2: Judgment Day	g10	p742	1991	8.1	Nearly 10 years have passed since Sarah Connor was targeted for termination by a cyborg from the future. Now her son, John, the future leader of the resistance, is the target for a newer, more deadly terminator. Once again, the resistance has managed to send a protector back to attempt to save John and his mother Sarah.	/5M0j0B18abtBI5gi2RhfjjurTqb.jpg
m232	Ugetsu	g06	p419	1953	8.1	In 16th century Japan, peasants Genjuro and Tobei sell their earthenware pots to a group of soldiers in a nearby village, in defiance of a local sage's warning against seeking to profit from warfare. Genjuro's pursuit of both riches and the mysterious Lady Wakasa, as well as Tobei's desire to become a samurai, run the risk of destroying both themselves and their wives, Miyagi and Ohama.	/7Kk1ZsrAul2Lg7Pe45XOcUf2ARQ.jpg
m233	Kitbull	g05	p746	2019	8.1	An unlikely connection sparks between two creatures: a fiercely independent stray kitten and a pit bull. Together, they experience friendship for the first time.	/mwKO3cZbxipgd9QAPboJVTDLPiN.jpg
m234	2001: A Space Odyssey	g15	p265	1968	8.1	Humanity finds a mysterious object buried beneath the lunar surface and sets off to find its origins with the help of HAL 9000, the world's most advanced super computer.	/ve72VxNqjGM69Uky4WTo2bK6rfq.jpg
m235	Jojo Rabbit	g02	p750	2019	8.1	A World War II satire that follows a lonely German boy whose world view is turned upside down when he discovers his single mother is hiding a young Jewish girl in their attic. Aided only by his idiotic imaginary friend, Adolf Hitler, Jojo must confront his blind nationalism.	/7GsM4mtM0worCtIVeiQt28HieeN.jpg
m236	A Taxi Driver	g10	p754	2017	8.1	May, 1980. Man-seob is a taxi driver in Seoul who lives from hand to mouth, raising his young daughter alone. One day, he hears that there is a foreigner who will pay big money for a drive down to Gwangju city. Not knowing that he’s a German journalist with a hidden agenda, Man-seob takes the job.	/iXVaWbxmyPk4KZGZk5GGDGFieMX.jpg
m237	Ran	g10	p087	1985	8.1	With Ran, legendary director Akira Kurosawa reimagines Shakespeare's King Lear as a singular historical epic set in sixteenth-century Japan. Majestic in scope, the film is Kurosawa's late-life masterpiece, a profound examination of the folly of war and the crumbling of one family under the weight of betrayal, greed, and the insatiable thirst for power.	/jQnUtWaHYfqnXPOIf77K7Ycqk4M.jpg
m238	Bound by Honor	g12	p758	1993	8.1	Based on the true life experiences of poet Jimmy Santiago Baca, the film focuses on half-brothers Paco and Cruz, and their bi-racial cousin Miklo. It opens in 1972, as the three are members of an East L.A. gang known as the "Vatos Locos", and the story focuses on how a violent crime and the influence of narcotics alter their lives. Miklo is incarcerated and sent to San Quentin, where he makes a "home" for himself. Cruz becomes an exceptional artist, but a heroin addiction overcomes him with tragic results. Paco becomes a cop and an enemy to his "carnal", Miklo.	/gvP6R6juhe2IpCG7QGDgjyUvm0g.jpg
m239	Doctor Who: The Time of the Doctor	g01	p761	2013	8.1	Orbiting a quiet backwater planet, the massed forces of the universe's deadliest species gather, drawn to a mysterious message that echoes out to the stars. And amongst them, the Doctor. Rescuing Clara from a family Christmas dinner, the Time Lord and his best friend must learn what this enigmatic signal means for his own fate and that of the universe.	/7blrzLLfj34vV45HYmPccvhNSRZ.jpg
m240	Silenced	g01	p764	2011	8.1	Based on actual events that took place at Gwangju Inhwa School for the hearing-impaired, where young deaf students were the victims of repeated sexual assaults by faculty members over a period of five years in the early 2000s.	/mbMp0oIFmYnw0i5gzRoKt8cH5ve.jpg
m241	My Neighbor Totoro	g06	p027	1988	8.1	Two sisters move to the country with their father in order to be closer to their hospitalized mother, and discover the surrounding trees are inhabited by Totoros, magical spirits of the forest. When the youngest runs away from home, the older sister seeks help from the spirits to find her.	/rtGDOeG9LzoerkDGZF9dnVeLppL.jpg
m242	Memories of Murder	g12	p043	2003	8.1	1986 Gyunggi Province. The body of a young woman is found brutally raped and murdered. Two months later, a series of rapes and murders commences under similar circumstances. And in a country that had never known such crimes, the dark whispers about a serial murderer grow louder. A special task force is set up in the area, with two local detectives Park Doo-Man and Jo Young-Goo joined by a detective from Seoul who requested to be assigned to the case.	/jcgUjx1QcupGzjntTVlnQ15lHqy.jpg
m243	Nights of Cabiria	g01	p394	1957	8.1	Rome, 1957. A woman, Cabiria, is robbed and left to drown by her boyfriend, Giorgio. Rescued, she resumes her life and tries her best to find happiness in a cynical world. Even when she thinks her struggles are over and she has found happiness and contentment, things may not be what they seem.	/xF4oCG3PLNbcrtPZbqB3BtkIbKg.jpg
m244	WALL·E	g05	p776	2008	8.1	WALL·E is the last robot left on an Earth that has been overrun with garbage and all humans have fled to outer space. For 700 years he has continued to try and clean up the mess, but has developed some rather interesting human-like qualities. When a ship arrives with a sleek new type of robot, WALL·E thinks he's finally found a friend and stows away on the ship when it leaves.	/zSDCorl36ZjAaUzADHLo5b8UfBu.jpg
m245	Hidden Figures	g01	p780	2016	8.1	The untold story of Katherine G. Johnson, Dorothy Vaughan and Mary Jackson – brilliant African-American women working at NASA and serving as the brains behind one of the greatest operations in history – the launch of astronaut John Glenn into orbit. The visionary trio crossed all gender and race lines to inspire generations to dream big.	/9lfz2W2uGjyow3am00rsPJ8iOyq.jpg
m246	Loving Vincent	g05	p783	2017	8.1	A young man arrives at the last hometown of painter Vincent van Gogh to deliver the troubled artist's final letter and ends up investigating his final days there.	/56sq57kDm7XgyXBYrgJLumo0Jac.jpg
m247	Prisoners	g01	p655	2013	8.1	Keller Dover faces a parent's worst nightmare when his 6-year-old daughter, Anna, and her friend go missing. The only lead is an old motorhome that had been parked on their street. The head of the investigation, Detective Loki, arrests the driver, but a lack of evidence forces Loki to release his only suspect. Dover, knowing that his daughter's life is at stake, decides that he has no choice but to take matters into his own hands.	/tuZhZ6biFMr5n9YSVuHOJnNL1uU.jpg
m248	The Red Shoes	g01	p789	1948	8.1	In this classic drama, Vicky Page is an aspiring ballerina torn between her dedication to dance and her desire to love. While her imperious instructor, Boris Lermontov, urges to her to forget anything but ballet, Vicky begins to fall for the charming young composer Julian Craster. Eventually Vicky, under great emotional stress, must choose to pursue either her art or her romance, a decision that carries serious consequences.	/vPvpBWFWDvEXuQBkoYgA6A89GVp.jpg
m249	Rocco and His Brothers	g12	p793	1960	8.1	When a widow’s family moves to the big city, two of her sons become romantic rivals with deadly results.	/pngL8AraChIDOiWnKF2o3S9kJzJ.jpg
m250	Elite Squad	g01	p796	2007	8.1	In 1997, before the visit of the pope to Rio de Janeiro, Captain Nascimento from BOPE (Special Police Operations Battalion) is assigned to eliminate the risks of the drug dealers in a dangerous slum nearby where the pope intends to be lodged.	/lwIXz785N2fXi8hsBr1IXciFlkM.jpg